,label,comment
4855,1,味道 一般 怪味 特别 猪皮 米饭 干净 头发 木签 一根 黑色 土豆丝
4856,0,还好 速度 挺快 服务态度 很好
4857,0,团团 特别 实惠 口味 不错 鹅肠 分量 十足
4858,1,差评 粉蒸 肥肠 从来 没吃过 难吃 见过 粉蒸 红烧 一样 体会 臭的 排骨 羊肉
4859,0,服务态度 很好 味道 不错 咖啡 少糖 减肥
4860,0,喜欢 朋友 推荐 味道 很好
4861,0,味道 超级 服务 很好 专门 蛋炒饭 店主 亲切
4862,0,菜品 不错 好吃 服务 不错 环境 不错
4863,0,多次
4864,0,非常 好吃 特别 蓝莓 芝士 店员 服务态度 很好 很帅
4865,0,顾客
4866,1,臭的 失望透顶
4867,0,几次 好吃 下次 依然 过来
4868,0,满意 不错 几次
4869,0,好吃 菜品 不错 价格 划算 环境
4870,0,味道 不错 服务员 速度 完全 不在乎 一样 提高 速度
4871,0,好吃 味道 真是 不错
4872,0,酸奶 好喝 紫米
4873,0,蛋糕 真的 好吃 过去 时候 才现 一会儿 这么久 评价 真的 喜欢 推荐
4874,0,挺好吃 味道 不错 下次
4875,0,杨金莲 服务员 服务态度 很好 服务 周到 菜品 妹妹 两个 人剩 好多
4876,0,菜品 味道 菜品 环境 很好
4877,0,东西 送错 脖送成
4878,0,真的 一个 超级 色相 好吃 下单 老子 小时 卧槽 见过 最差 外卖 货员
4879,0,多次 喜欢 没有 团购 四人 套餐
4880,0,几次 方便 划算
4881,0,态度 很好 环境 比较 舒服 上菜 速度 稍微 有点 还好 香辣 黄金 鲫鱼 比基尼 牙签
4882,0,量少 出奇 味道 没有 赵记 小龙虾 特别 没有 一次
4883,0,服务 热情周到 满意 好吃 很大 两个 大到 员工 激情 七点 小苹果 活力
4884,1,小强 头发 第一次 糖醋 里脊 番茄酱 炒肉加 黄瓜 真不知道 李大仁 坚持 下来
4885,0,蛋糕 好吃 新鲜 榴莲 蛋糕 好吃 送货 很快
4886,0,难吃 无色 无香 无味 没有
4887,0,提前 半小时 打电话 预定 很快 做好 非常 方便 商家 非常 耐心 后面 急事 办法 店里 自提 快递 快递费 不贵 冰袋 大大的 良心 商家 值得 推荐 以后 朋友 过生日 不用 知道 直接 微信发 地址 快递 过去 搞定 方便快捷
4888,0,不错 几次 有时候 有点
4889,0,点半 送到 结果 送过来 饿死
4890,0,第二次 购买 菜品 新鲜 分量足
4891,0,香菜 牛肉 土豆片
4892,0,好吃 好找
4893,1,下雨天 外卖 菜里 钢丝
4894,1,很少 评论 在外 做生意 容易 送过来 叉烧 明显 馊了 经常 粤菜 这种 水准 营业 态度恶劣 推脱
4895,0,味道 巴适 麻又辣 老板 舍得 放料 食欲 大增 重要 酒水 免费 酒水 免费 酒水 免费 三个 十瓶 老板 舍得 老板娘 热情
4896,0,第二次 孩子 满意
4897,1,真心 不好吃 皮蛋 瘦肉粥 有点 馊的 感觉 我要 红烧肉 变成 粉蒸肉 难吃 看着 不错 完全 浪费 不值 皮蛋 瘦肉粥 基本 有点 馊 难吃
4898,0,分量 挺足 味道 也好
4899,0,团购 安逸 两个 吃得饱 分量足 现烤 蛋挞
4900,0,好吃 已经 知道 第几次 朋友 下回 真的 早些 常常 等位 生意 实在 太好了
4901,0,清汤 味道 浓郁 独特 有家 感觉 老板娘 确实 热情 cute 目测 年纪 应该
4902,0,分量 点儿 两人餐 两个 永远 吃不完 哈哈哈 味道 好吃
4903,0,牛肉 新鲜 丸子 特别 有劲 沙茶 好吃 汤底 味道 鲜美 三人餐 估计 两个
4904,0,非常 服务 非常 周到 卫生 干净
4905,0,口感 看着 食欲 下次 朋友 起来
4906,0,多次 一如既往
4907,0,不错
4908,1,味道 难吃 牛肉 一股 臭味 速度
4909,0,经济 实惠 多次 下次 继续
4910,0,很好 很好 非常 希望 品质 一如既往 做好
4911,0,味道 很好 服务员 态度 很好
4912,0,蛋糕 新鲜 味道 很好 网上 划算 服务态度 超好 下次 继续 光临
4913,0,香味 肉质 很嫩 推荐 脑花 小菜 一起 味道 不错
4914,1,生 里面 钢丝 难吃
4915,0,喜欢 鹌鹑蛋 套餐 朋友 一起
4916,1,红心 火龙果 没有 换成 水果 一个 火龙果 两个 东西 黑心 水果店 黑心 老板 以后 再也 你家 水果 小伙伴 美团 他家 水果 一定 慎重考虑
4917,0,性价比 味道 很棒 以后 还会来
4918,0,速度慢 味道 不行 退款 送到
4919,0,烤鸭 套餐 烤鸭 套餐 结果 直接 板鸭 一坨 骨头 为啥 烤鸭 失望 没有 下次 几坨 几乎 全是 骨头 板鸭 难吃 难吃 难吃 他家 图片 实物 完全 不符 看看 难吃 骗人
4920,0,味道 不错 蛋糕 图片 一模一样 服务 色情
4921,0,几次 特别 适合 两个 逛街 方便
4922,0,支付宝 支付 非常 方便快捷 优惠 米线 好吃 下次 路过 两碗
4923,0,第一次 下午茶 好吃 特别 划算 水果 刨冰 里面 水果 多多 红豆 多多 服务员 态度 很好 超级 实惠 赶紧 朋友 来团 一个
4924,0,第二次 态度 味道
4925,0,以后 吃火锅 一如既往 态度
4926,0,不管是谁 原因 预计 分钟 一个 一个半 小时 动态 完全 没有 更新 快递 天送 容易 商家 很大 责任
4927,0,非常 不错 生意 很好 服务员 服务 很好
4928,0,男票 一起 环境 很小 比较 清净 牛排 新鲜 分量 两人 足够
4929,0,太少 难吃
4930,1,草莓 浓烈 一股 酒味 草莓 史上 难吃 草莓 毛病
4931,0,一手 重庆火锅 老牌子 火锅 味道 确实 不错 麻辣 好吃 现在 鸭肠 起爽 看起 像鹅肠 菜品 分量足
4932,0,新鲜 份量 不会 团购 服务态度 不好 麻辣 牛肉 泰国 耗儿
4933,0,一个 好吃
4934,0,份量 味道 环境 服务 不错 好评
4935,0,知道 没有 花生米 味道 一般 勺子
4936,0,味道 真的 不错 尤其 今天 火锅 配上 酸奶 心情 美美
4937,0,小店 味道 真的 双人 套餐 两个 大胃 明显 不够 价格 非常 实惠
4938,0,觉得很有 情调 地方 家人 一起 好吃 海鲜
4939,0,味道 不错 团购 分量 菜品 新鲜
4940,0,位置 很好 嘉陵江 菜品 丰富 食材 新鲜 服务 很好 值得 推荐 绿色 牛肉 杏鲍菇 土猪 五花肉 五花肉
4941,0,味道 很好 辣味 喜欢
4942,0,还可以 晚上 新鲜
4943,0,好吃 米线 药膳 好喝
4944,1,送来 时候 整个 袋子 一会 拉肚子 几次 知道 是不是 卫生
4945,1,一个 二个 脑壳 一次 送错 两次 送错 点哩 炸鸡块 非要 拿成 臭 鸡腿 故意 是不是
4946,0,态度 很好 牛排 比较 整体 感觉 不错 感觉 有点 没有 吃饱 玉米浓汤 好喝
4947,0,分量 很足 味道 很好 妹子 忙不过来
4948,0,服务 菜品 分量 环境 非常 服务态度 老板 服务员 特别 介绍 餐厅 用餐 时来 几次 用餐 服务态度 真的 很好 环境 特别 灯光 摆设 看着 舒服 菜品 非常 好吃 尤其 牛排 特别 好吃 重点 无限量 牛排 很好 下次 还会 酸奶 自制 酸奶 热狗 牛排 自助 布丁 凉菜 凉拌 寿司 薯条 炒面 冰淇淋 丸子 冰粉 意面 炒饭 意大利 牛排 葡萄
4949,0,很棒 菜品 丰富 新鲜 环境卫生 杠杠
4950,0,两个 小时 送到 幸苦 成冰 夏天 估计 美味
4951,0,味道 很好 朋友 多次 老板 热情
4952,0,难吃
4953,0,不能 准时 送到 一次
4954,0,蛋糕 很漂亮 老公 不小 惊喜 一点点 不够 没有 想象 味道 还可以 花瓣 新鲜 没有 一点 破坏 英寸 爱情 主题 玫瑰 蛋糕 同城 公里 免费 配送 到家
4955,0,味道 牛肉 大坨 超级
4956,0,不用 味道 肯定 一如既往
4957,0,很好 男票 喜欢 几次 味道 不错
4958,0,筷子 没有 nbsp nbsp nbsp nbsp nbsp nbsp 冷得
4959,0,东西 装备 筷子 没有 配送 还慢 分量 还少
4960,0,口味 很好 分量足 服务 很好 环境 很好 总体 不错 值得 推荐
4961,1,第一次 他家 还可以 凉拌 三丝 里面 有个 飞虫 之类 东西 可恶
4962,1,打开 闻到 一股 臭味 本来 送到 结果 分才 臭了 回锅肉 奇香 外婆 回锅肉 奇臭 差不多 卖家 良心
4963,1,韭菜 没切 太过 一股 闷菜 味道 马上 拉肚子
4964,0,味道 很棒 颜色 看起来 不错 服务 非常 热情 适合 朋友 下次 一定
4965,0,超级 喜欢 紫米 口感 不错
4966,0,特别 份量 挺足 味道 特别
4967,0,去过 几回 味道 好吃 分量 很足 还会
4968,0,服务 菜品 新鲜 味道 巴适 下次 还来
4969,0,团购 两人餐 每个 好吃
4970,0,一如既往 好吃 排队 人太多
4971,0,分量足 味道 不错 老板 很好 热情
4972,0,改良 重庆火锅 不太辣 感觉 油腻 特别 喜欢 下午 四点 多去 没到 点儿 听说 他家 点儿 排号
4973,0,份量 服务 下次
4974,1,确实 知道 怎么弄 春卷 里面 竟然
4975,0,哎哟 晚上 选择性 很多 例汤 没有
4976,0,回头客 味道 很好 猪肝
4977,0,味道 不错 特色 泡菜 算个 特色 好吃 老板娘 热情 很好 推荐
4978,0,红烧肉 非常 好吃 服务态度 很好 环境 优雅 值得 一试
4979,0,筷子 没得
4980,0,真心 不错 已经 几次 服物 不错
4981,0,可乐 不算 菜品 里面 饮料 不算 菜品 价格
4982,0,菜品 丰富 味道 不错 价格 实惠 服务态度 很好
4983,0,服务周到 味道鲜美 可口 实惠 分量足
4984,0,挺不错 皮大 肉馅 好吃
4985,0,经常 解放碑 不错 味道 不错 态度 亲切
4986,0,味道 相当 不错 店面 干净 卫生 下次 还会 光顾
4987,0,小伙伴 重庆 吃点 重庆 特有
4988,0,口味 菜品 环境 服务 下次 还会
4989,0,味道 不错 干净 位置 也好
4990,0,不错 第二次 满意
4991,0,强烈推荐 已经 回购 多次 价格便宜 很漂亮 味道 很好
4992,1,打开 看到 一条 虫子 恶心 到家
4993,1,三个 口水鸡 偏淡 没有 盐味 粉蒸肉 离谱 肥肠 居然 真怕 拉肚子 做生意 哪里 回头客
4994,0,第一次 感觉 服务 超级 卫生 环境 超级 整洁 干净 特地 推荐 味道 很好 下次 重庆 还会
4995,1,蕃茄 味道 太淡 反胃
4996,0,怪味 咸不 咸甜 之前 老公 难吃 不信 今天 知道 一般 难吃 店里 厨子 东西 只想 重点 还行
4997,1,馊的 我点 里脊 尽然
4998,0,好吃 一如既往 好吃 倍儿 多次
4999,0,开始 地理位置 复杂 结果 马路上 一眼 看到 蛋糕 不错 漂亮 好吃
5000,0,味道 不错 服务 很好 以后
5001,0,不错 老板 不错
5002,0,底朝天 没用 看到 肉片 本来 不想 评价 谢谢 一声
5003,0,好吃 好吃 服务 很好 还会来
5004,1,土豆丝 馊了 满意
5005,0,味道 超辣 没有 团购 差别
5006,1,豆腐 里面 蚊子 菜品 真的 新鲜 最气 一次 外卖 饿死 重新 出去
5007,0,味道 一如既往 服务员 妹妹 态度 特别 棒棒 豆腐 魔芋 好吃 分量 很足 有点 小个 刺太多 哈哈
5008,0,第二次 觉得 味道 不错 生滚 食材 放入 好了吧 里面 螃蟹 鱿鱼 打包 验证 号牌 不用 菜品 之后 号牌 震动 发出 鸣叫 过去 比较 人性化 不错 分量足
5009,0,快递 分钟 打开 来看 烧烤 怎么吃
5010,0,喜欢 她家 日式 猪排 时候 过于 油腻 喜欢 小菜 茄子 可能 比较 喜欢 茄子 服务员 态度 特别 不够 其实 特别 喜欢 包菜 猪排 配在一起 格外 好次
5011,0,菜品 不错
5012,1,筷子 发霉 筷子 臭的 一口 本来 想点 退单 不知 取消 退单
5013,0,好吃 经常 他家 凉皮 有面 味道 肉夹馍 超级 好吃
5014,0,味道 很好 三个 很饱 位置 有点 好吃
5015,0,煎饼 味道 干净 卫生
5016,0,感觉 灰常棒
5017,0,难吃 要死 年糕 估计 生滴
5018,0,味道 还可以 服务态度 性价比
5019,0,味道 非常 服务 非常 重要 江景 非常 喜欢
5020,0,分量 根本 不够 我点 很多 没有
5021,0,实在 难吃
5022,1,佐料 几棵 现在 商家 降低成本 真是 味道 难吃 荷叶 一个 馊味
5023,0,上菜 速度 有待 加快 味道 不错
5024,0,味道 不错 分量足 第二次
5025,0,味道 真的 不错 多次
5026,0,喜欢 没有 之一 三个 味道 很好
5027,0,菜品 丰富 新鲜 很多 味道 很好 这家 显得 重庆
5028,0,态度 很好 送货 及时 包装 精美
5029,0,团购 便宜 很足 几次
5030,0,第一次 美团 购物 服务员 态度 耐心 讲解 味道 不错
5031,0,不到 十元 饱饱 味道 不错 菜品 丰富 不用 纠结 一个 地方 吃饭 推荐
5032,0,服务 速度 好喝 喜欢 原味
5033,0,实惠 味道 还好
5034,0,挺不错 女朋友 生日 朋友 一起 过来
5035,0,价格 实惠 环境 优雅 鸭肉 好吃
5036,0,服务 很好 菜品 美味 榨菜 极了
5037,0,菜色 很好 装修 特色 公司 聚餐
5038,0,一如 即往 好吃 服务态度 很好 顾客 认识 热情 一直 光顾
5039,0,帅哥 味道 不错 分量足 下次
5040,0,现杀 活羊 味道 非常 老板 耿直
5041,0,不错 外面 层皮 很脆 奶油 合适 很滑 不腻
5042,0,学校 门口 方便 平时 人多 排队 味道 很好
5043,0,不错 分量 人太多 门口
5044,0,帮忙 没带 差评 以后 不买
5045,0,芝士 红茶 第一次 店员 热情 推荐 主打产品 味道 不错
5046,0,面皮 没有 以前 好吃
5047,0,本来 喜欢 评论 忍不住 番茄酱 一包 手掌 满月
5048,0,多次 够味儿 棒棒 老板 态度 很好
5049,1,变味 几样 东西 臭的 菜品 不新鲜 变味
5050,0,一直 喜欢 鸡排 家鸡 好吃
5051,0,味道 纯正 服务 一流 上菜 环境 优雅
5052,0,蛋糕 店家 很好 蛋糕 漂亮 大小 合适
5053,0,菜品 分量足 老板 服务态度 也好
5054,0,多次 李记 唯独 大坪 时代 天街 这家 味道 觉得 好吃 一家 每次 朋友 过来 不错
5055,0,服务 不错 上菜 挺快 好评 机会 回来
5056,0,油炸 榴莲 好吃
5057,1,一般 好评 这次 真的 差评 绿豆粥 馊的 怎么吃
5058,0,真的 超级 开心 很棒 地方 正好 过生 美女 店主 装饰 一下 时候 真的 惊艳 很暖心 店主 心真 超级 过生 一瓶 饮料 时候 给我发 一个 红包 简直 不能 菜品 颜值 超级 超级 好吃 好评 对不起 一定 还会
5059,0,味道 不错 位置 比较 好找 三峡 广场
5060,1,开始 觉得 知道 一只 一口 一只 居然 臭的 那种 死久 鸡味 恶心 讲真 很长 一段时间 提不起 兴趣 炸鸡
5061,0,味道 很好 喜欢
5062,0,真的 很差 很无语
5063,0,一如既往 好吃 强烈推荐 光顾
5064,0,小龙虾 不卖 土豆 土豆 挺好吃 龙虾 味道 不劲 毫无 特色 难吃 龙虾 我要 听装 国宾 送成 瓶装 甲鱼 一股 腥味 毛豆 脑花
5065,0,味道 服务 五星 好评
5066,0,太慢 再也 不吃
5067,1,难吃 米线 硬得 起来 塑料 一样 难以 下咽 香肠 臭的 一口 失败 一次 订餐 不会 光顾
5068,1,豆腐 肉沫 已经 变质 烧白 扣肉 没有 到位
5069,0,挺好吃 大个 干锅 地方
5070,0,菜品 不错 喜欢 酱汁 麻辣 应该 更棒
5071,0,今天 这菜 没有 黄瓜
5072,1,肉太肥 晚上 恶心 拉肚子
5073,0,服务周到 菜品 十分 好吃 强烈推荐
5074,1,关健 变质 打电话 电家 可能 店面 我家 十分钟 路程 不到 快递 小哥 送得 很快 可能 路途 原本 平时 经常 以后 不会 光顾
5075,0,真的 恶心 这家 每次 半小时 态度 不好 不说 退款
5076,0,确实 物美价廉 位置 价格低 份量
5077,0,服务 不错 菜品 丰富 烧烤 海鲜
5078,0,荤素 搭配 里面 洋芋 金针菇 鸡肉 很嫩 好吃
5079,0,早上 这家 决得 很好 推荐 朋友 尝尝 这家 注明 配送 咸菜 店家 没有 配送 咸菜
5080,0,泡菜 加点 泡菜 根本 客户 要求
5081,0,几次 性价比 不错
5082,0,一如既往 好吃 价格 便宜 味道 巴适
5083,0,
5084,0,鸡蛋 非常 好吃 非常 喜欢
5085,0,味道 环境 不错
5086,0,味道 很好 小锅 一个 很饱 凉菜 味道 很好
5087,0,味道 第一 佳大鸡 排比 主要 感觉 肉汁 鲜嫩 差一点 价廉物美 团购 力度 并不大 店里 本来 活动 香辣 比较 孜然 搭配 两种 调理 不错 冰冻 酸梅汤 味道 正宗 没有 那种 色素 调理 感觉 鸡排 新鸡排 美味 油腻
5088,0,不错 好吃 分量 下次
5089,0,味道 不错 吃饱 保持身材 秘诀
5090,0,不好吃 差评 青椒 土豆丝
5091,0,菜品 不错 适合 胃口 下次
5092,1,发现 里面 头发 卫生
5093,0,几次 味道 分量足 环境 服务 也好 二人 六十八 肚子 满意
5094,0,好吃 叮当 好吃 服务 也好
5095,0,好吃 态度 很好
5096,0,好喝 木瓜 牛奶 木瓜 很重 浓郁 炎热 夏天 喝一杯 简直 太爽 享受 芒果 千层 蛋糕 很棒 芒果 甜酸 刚好 不会 过酸 芒果 牛奶 挺不错 芒果 蛋糕 很配 逛街 坐坐 团购 划算
5097,0,炒饭 难吃 尤其 小炒 平时 米线 还可以 难吃
5098,0,分量 确实 菜品 比较 精致
5099,0,真心 超级 无敌 好吃 一份 鸡排 两份 两个 女生 外面 酥脆 里面 大鸡排 每天 想着 里面 服务员 超级 热情 全是 帅哥美女 一群 干劲 年轻人 帅哥美女 养眼 下次 还来
5100,0,朋友 一起 开心 味道 不错
5101,0,旅行 时团 一个 足够 味道 服务 不错
5102,0,味道 不错 分量 平时 一样 值得 推荐
5103,0,非常 好吃 好吃 态度 超级
5104,0,不麻不辣 味道 刚刚 菜品 比较 齐全 干净
5105,1,苍蝇 恶心 土豆 面上
5106,1,苍蝇 直接 上图 感受 差点 吐出来
5107,1,一半 发现 一只 虫 现在 反胃 卫生
5108,0,味道 很好 份量 一点点
5109,0,几次 一直 觉得 服务态度 继续 下去 鸡排 味道 不会
5110,0,顾客 改名字 之前 经常 现在 服务 改善 很多 味道 不错
5111,0,每次 出差 一定 几次 分量 很足
5112,0,价格 实惠 味道 真的 不错
5113,0,本来 小龙虾 无意间 看见 这家 烤肉店 评论 看见 照片 评论 多肉 忍不住 立马 过去 位置 好找 一下 看见 服务员 热情 特别 上菜 速度 一个 负责 分开 负责 一个 一个 拿上来 本来 要死 结果 一到 店里 坐下 小菜 素菜 几分钟 菜品 上齐 大概 五分钟 左右 服务员 服务态度 很好 小菜 还可以 免费 凉拌 黄瓜 豆芽 泡菜 烙饼 寿司 一个 两个 没有 挺好吃 一半 服务
5114,0,味道 好吃 独特 环境 那条 太太
5115,0,米线 好吃 地方 好找 下次
5116,0,鸡排 味道 非常 肉质 很嫩 非常 大块 很饱 他家 种类 小吃 非常 丰富 供选择 环境 干净 整洁 服务员 服务态度 热情 特别 主要 价格 特别 实惠 划算 一杯 酸梅 赠送 下次 还会 位置 少年 路口 值得 推荐
5117,0,服务 菜品 环境 各个 方便 挺不错 一家 用心 串串 回去
5118,0,服务态度 很好 非常 热情 希望 能够 保持 本来 回头客 感觉 不错 上次 麻辣 可能 天气 太热
5119,0,嘉利华 蛋糕 真心 不错 团购 服务 依然 很好 打电话 预约 时问 详细 认真 蛋糕 时候 态度 很好 团购 券是 店铺 通用 不错
5120,0,感觉 水果 一点 不新鲜 结果 七点 送到 关键 派送 物管 吵起来 小区 外面 车厘子
5121,1,稀饭 同事 过来 注意 直接 一口 现在 中毒 一直 拉肚子 直接 消防 医院 急诊 真是 卫生局 查封 大热天 这种 东西 完全 没有 味道 稀饭 知道 时候 酸得 不能 下口 竟然 还给 送过来 老板 解释一下
5122,0,环境 不错 菜品 新鲜 拍照 赞赞 刚好 没水
5123,0,已经 去过 多次 觉得 以前 四人 套餐 划算 已经 很好
5124,0,分量足 味道 不错 老板 没有 团购 区别对待 全都 好评
5125,0,好吃 好吃 重点 划算 美团 比店 里面 便宜 好几块
5126,0,菜品 分量 味道 非常 应该 师傅 技术 很好 色香味 俱全 水煮 肉片 地道 空心菜 色泽 很好 值得
5127,0,不错 玉米 好吃 太甜 应该
5128,0,正宗 重庆 火锅 味道 新鲜 推荐
5129,0,今天 用餐 朋友 起来 用餐 愉快 b5 服务员 态度 不错 热情
5130,0,喜欢 三鲜 米线 真的 超级 满意 食材 新鲜 超大 老板 服务态度 真的 太好了 各种 满意
5131,0,味道 不错 环境
5132,0,老板 健谈 咖啡 味道
5133,0,味道 服务 分量足 哈哈哈 哈哈哈
5134,0,一直 爱来 环境 菜品 新鲜 适合 家人 聚会
5135,0,不错 好喝 老板娘 很好 不太想 原味 老板娘 珍珠 换成 布丁 多次
5136,0,多次 不错
5137,0,环境 不错 去过 多次 感觉 不错 老板 热情 配图 老板 壁画 合影
5138,1,超级 吃豆腐 臭 晓得 好久 从来不 差评
5139,0,味道 棒棒 菜品 新鲜 出菜 速度 位置 很好
5140,0,芒果 千层 盒子 ## 四寸 蛋糕 便宜 难吃 蛋糕 千层 一口
5141,0,难吃 花椒 特别 没有 味道 两条 一条
5142,0,不好吃 味道 不错
5143,0,菜品 味道 巴适 数量 服务 周到 就餐 环境 舒适 家人 说好 希望 下次 机会
5144,0,非常 服务 很好 口味 不错 色相 俱全 非常 好评
5145,0,环境 很好 服务态度 非常 感觉 路边摊 干净 卫生 味道 棒棒 下次
5146,0,味道 前台 妹儿 态度 不好 态度
5147,1,没有 青椒 皮蛋 肥肠 无比 馊 希望 一个 解释
5148,0,味道 不错 没有 宣传 没有 一抿 就化
5149,0,口味 不错 小孩子 喜欢 一下
5150,0,味道 非常 值得 再次 品尝 真的 很好
5151,0,难吃 筷子
5152,0,酸辣粉 时候 小丸子 酸辣粉 小丸子 刚好 其实 两根 签子
5153,1,拉肚子 一上午 闺蜜 两个 一起 确实 差评
5154,0,味道 很好 分量 很足
5155,0,口感 很甜 那种 美女 老板 很好
5156,0,坑人 全是 时间 太久 退单 反正 差差
5157,0,人餐 菜品 新鲜 味道 很好 网上 下单 打个 电话 订位 位置 好找 小学 转盘 分享 一下
5158,0,经常 味道 还可以 牛排 味道 需要 加强 菜品 换换 每次 没有 新鲜感
5159,0,不错 好找 下次 还会 上菜 速度 还好
5160,0,好吃 独特 酸酸 辣辣的 味道 很辣 小料 太辣 后来 小料 直接 汤太 美味 一碗 一碗
5161,1,几次 色香味 不错 味道 不错 这次 真的 失望 失望 颜色 暗沉 鸡蛋 居然 发霉 个糊 臭味 店里 剩菜 剩饭 回锅 面上 撒点 看不出来 jb 恶心
5162,0,顾客 这次 真的 难吃 烤肉 难吃
5163,1,老板 里面 头发
5164,0,环境 不错 服务态度 很好 去过 几次 值得 推荐
5165,0,小哥 服务态度 好好 调试 认真 细心 热情 推荐 不同 口味 做出 饮料 饮料 重要 觉得 相同 一款 饮料 不同 做出 味道 很多 反正 现在 越来越 喜欢 放牛班 希望 夏天 新品种 观音桥 单单 贡茶 还可以 选择 放牛班
5166,0,国宾酒店 住宿 环境 高大 价格 不贵
5167,0,不错 老板 很好 味道 好吃 几次
5168,0,环境 很好 味道
5169,0,小龙虾 五个 三个 两个 不得了 原材料 味道 还行 中份 没有 卖家
5170,0,味道 非常 分量 强烈推荐 万达 附近 朋友 过来 尝试
5171,0,非常 份量 味道 也好 免费 奶油鸡蛋 玉米 环境 服务态度 很好 朋友 两人餐 感觉 三个 最后 好多 五花肉 好吃 昨天 太太 炒年糕 吃药 菜汤 好多 一次 一定 还会
5172,1,馊的 怎么吃 盒子 打开 一股 馊味
5173,0,经常 一个 人来 鲫鱼 真的 好吃 老板 态度 还好 不因 团购 区别对待 四个 味道 每个 好吃 米饭 泡菜 好吃 超赞
5174,0,好吃 好吃 喜欢 味道 服务态度 也好 喜欢 火锅 之一 下次 还来
5175,0,还行 味道 一般般 份量 挺足 环境 还可以
5176,0,奶茶 好喝 漂亮 推荐 大叔 奶茶
5177,0,四季豆 没有 味道 不好吃
5178,1,送来 卤鸡 臭的 联系 老板 老板 一个 过来 两块钱 退钱 就让 一个 送来 送来 时候 上班 送餐 阿姨 放在 桌子 鸡蛋 臭的 不了 告诉 卤料 无语 当时 准备 放在 盒子 里面 鸡蛋 打开 一个 臭 完全 送个 臭蛋 不信 臭 老板 没有 闻到 送餐 阿姨 没有 闻到 再次 打电话 老板 送来 臭的 老板 送餐 阿姨 一样 卤料 真的 气不过 理论 几次 之前 卤蛋 样子 鸡蛋
5179,0,口味 很好 菜品 新鲜 开始 时间 很快 没有 老板娘 热情 团购 米饭 随便 米汤 团购 价格 真正 划算 性价比 超高 建议 尝尝 很多 基本上 吃不出 食品 添加剂
5180,0,难吃 太少 哪里 难吃 酸辣 鸡渣 竹笋 炒点 简直 不了 重来 评价 想象 这菜 好好
5181,0,还会 此行 味道 不错 环境 小资 聚餐 地方
5182,0,第二次 光顾 店主 热情 分量足 新鲜
5183,0,分量 很足 两个 吃不完 味道 很好 入味 多次
5184,1,发现 里面 有虫 知道 是不是 一只 虫 时候 注意
5185,1,上面 居然 钢丝 之类 东西 上面 里面 用力 扯出来
5186,0,好吃 几次 下次
5187,0,味道 很好 老板 礼貌 份量 饱饱
5188,0,还可以 吃火锅 优选 很多 朋友 同事 性价比 值得 推荐 两天 温度 适宜 阳台 吃饭 火锅 惬意
5189,0,摇一摇 瓶酒 不错 味道 菜品 新鲜
5190,0,不错 环境 味道 比较 地道 份量 性价比 一般
5191,0,好吃 老板 很好 觉得 好吃 推荐 朋友 导致 朋友 经常 可能 朋友 绝交 哈哈哈
5192,1,番茄 已经 拿来 做菜 不怕 中毒 真的 商家 良心 番茄 炒蛋 成本 样子 蔬菜 致癌 可能 中毒
5193,1,时候 味道 昨天晚上 早上 起来 拉肚子 肚子 一直 一直 再也不会 你家 外卖 辣鸡
5194,0,味道 不错 环境优美 服务态度 不错
5195,0,一如既往 好吃 点赞
5196,0,难吃 烧烤 没有 之一 蒜蓉 茄子 东西 难吃 备注 干别 块钱 一份 三线 结果 小小的 一片 块钱 一小块 三线 标注 一下 一点 失望 完全 以前 店里 味道
5197,0,坑人 没有
5198,0,味道 不错 牛排 里面 甜品 不错
5199,1,难吃 韭菜 简直 市场 那种 臭的 一个 蛋炒饭 硬得 差点 牙齿 咬掉
5200,0,多次 味道 很棒 老板 态度 娃儿 喜欢 以后 还会 继续
