,label,comment
7588,1,香菇 不到 分钟 严重 拉肚子 太过分 以前 外卖 没有 拉肚子 还点 外卖 食材 肯定 不新鲜 差评
7589,1,馊的 nbsp 怎么吃
7590,0,怎么吃 学徒
7591,0,经常 经济 实惠 不错 小伙伴 试试 方便 速度 不用 好久 顾客
7592,0,菜品 新鲜 份量 整体 不错 特别 有位 年长 服务员 很暖心 因是 团购 担心 不够 再加 温馨 提示 不用 点太多 不够 再点 更好 顾客 着想 商家 已不多 商家 大大的
7593,1,不好吃 不新鲜
7594,0,真的 一般 难吃 送货员 居然 一个 小时
7595,0,藤椒 鸡排 不好吃 一点 不脆 根本 没有 藤椒 味道 黄金 鸡柳 根本就是 鸡肉 软绵绵 汉堡 可能 口味 东西 一点 不好吃
7596,0,菜品 非常 不错
7597,0,团购 服务员 热情 没有 团购 服务员 非常 礼貌 自助 西瓜 龟苓膏 凉虾 冰粉 ... 火锅 味道 开始 没有 感觉 后面 味道 好吃 有点 适合 口味 菜品 新鲜 份量 团购 四人餐 实际 没有 服务员 二罐 调味 吝啬 最后 环境 时候 非常 吃饭 高峰期 还好 运气 没有 毕竟 非常 好找 位置 有点 厕所 布帘 遮到 不会 闻到 厕所 拉开 帘子
7598,0,味道 不错 经常 朋友 非常 满意
7599,1,难吃 酸菜 臭 鱼甲 干净
7600,0,难吃 太少 不好 以前
7601,0,感觉 还可以 环境 干净 人少
7602,0,老板 热情 细心 浙江 定制 永川 朋友 确定 不错 下次 还来
7603,0,实物 一样 石锅
7604,0,啤酒 不冰 天气
7605,0,味道 不错 环境 非常 老板 服务 热情 菜品 完全 没有 团购 打折扣 下次 一定 花生米
7606,0,喜欢 小朋友 几次 私房 非常 价格 便宜 总体 物有所值
7607,1,快递 小哥 服服 其实 开始 还可以 里面 头发 直接
7608,0,老板娘 态度 很好 下次 还来 不错
7609,1,筷子 长霉 还给 关键 今天 吃饭 四个 拉肚子
7610,0,很好 几次 一如既往
7611,0,还行 味道 一般 菜品 很多 有点 小鬼 团购 比较 划算
7612,1,虫
7613,1,饺子馅 臭了
7614,0,卫生 看见 厨师 凉菜 洗手 凉菜 旁边 一个 洗手盆 口味 不错 那种 快餐 形式 值得 推荐
7615,0,比较 划算 验证 座机 一直 没人接 后来 门市 一个 手机号 验证
7616,0,味道 挺棒 多次 每次 生意兴隆
7617,0,装错 有理 极其 恶劣
7618,0,超级 胃口 很好
7619,0,难吃 卤肉 骗人 完全 肉粒
7620,0,用餐 环境 很好 服务态度 上菜 速度 比较 代金 划算 不错 团购
7621,0,不用 介绍 味道 简直 一级
7622,0,牛肉 味道 不错 两人 刚好
7623,1,哪有 恶心 鸭血 和培根 臭了 一点 职业道德 没有
7624,0,菜品 不错 分量足 价格 合适 环境 不错 值得 推荐
7625,0,超级 几次 下次 还会
7626,0,之前 美团 看见 一直 味道 非常 服务员 态度 特别 一直 火候 里面 非常 大概 是因为 好吃 菜品 好多 六种 味道 牛肉 好吃 店里 装修 特别 好多 串才 几十块 划算 推荐 一下
7627,0,肉末 茄子 看见 茄子 看见 小炒 特别 不好吃
7628,0,口味 太差 好像 外行人 不好吃
7629,0,一直 一直 觉得 新鲜 口味 很好
7630,0,很好 老板 很好 热情 环境 不错
7631,0,位置 好找 道旁 奶茶 味道 很好
7632,0,几次 非常 不错 尤其 推荐 鲫鱼
7633,0,口感 很好 值得 拥有 下次 介绍 朋友
7634,1,八宝粥 酸臭 酸臭 一口 烂掉
7635,0,上菜 挺快 挺好吃 两个 人刚 好吃
7636,0,第一次 过来 味道 好吃 喜欢 菜品 份量 很足 下次 还会 朋友 过来
7637,1,卫生 红烧 肥肠 里面 很大 一个 虫子 看到 有虫 一半 早上 真是
7638,0,服务周到 摆盘 美丽 大气 包厢 舒服 宽敞 喜欢 吃饭 忘记 拍照
7639,0,忘记 放糖 全是 咸味 一点 甜味 没有
7640,0,菜品 越来越 好吃 几道 川菜 味道 很棒
7641,0,垃圾 速度 老子 饿死 老外
7642,1,蛋糕 之后 集体 拉肚子
7643,1,
7644,0,团购 几次 每回 满意 不错 环境 味道 不错
7645,0,菜品 充足 新鲜 宴请 非常 合适 以后 推荐 朋友
7646,0,味道 米饭 超级 好吃 喜欢 喜欢
7647,0,顾客 味道 ..
7648,0,非常 满意 分量足 味道
7649,1,前面 两次 觉得 这次 味道 太差 里面 一根 头发 里面 一根 胶线 恶心 从此以后 不会 再点 特别 每次 小菜 一样
7650,0,没有 年糕 我点 两个 没有 吃饭 年糕
7651,0,口味 一直 很好 卖家 贴心 计算 几张 美团券 合适 好评
7652,1,卫生 难吃 不好 整盆鸡 馊味 两个 拉肚子 鸡肉 分量 明显 缺斤少两 以前 阳光城 斜坡 那家 每次 两个 吃不完 这次 两个 不够 全是 同样 套餐 贪便宜 这家 后悔
7653,0,环境 很好 服务态度 不错 关键 菜品 一流 色香味 俱全
7654,0,去过 几次 不错 下次 还会 继续
7655,0,环境 味道 菜品 丰富 好找 下次 还会
7656,0,备注 白米饭 每次 锅巴 饭哟
7657,0,非常 菜品 新鲜 有待 提高 烧烤 不好吃
7658,0,甜品 味道 不错 份量 很足 经常
7659,0,店员 热情 服务周到 菜品 新鲜 味道 适合 大众 口味 店内 水果 作料 各种 米饭 冷饮 几乎 齐全 女生 还可以 免费 指甲 头发 吃饭 店家 还会 橡皮筋
7660,0,味道 服务态度 不错 划算
7661,0,不错 两人餐 完全 够吃 味道 真心 不错
7662,0,多次 味道 不错 环境 还好
7663,0,牛排 好吃 其实 觉得 牛排 套餐 还好 一点 自助 总想 没有 意义 牛排 套餐 ## 黑椒 牛排 ## 金针菇 培根
7664,1,简直 气愤 酸臭 连锁店 这种 态度 直接 恶心
7665,0,酸辣粉 好吃 鸭脖子 好吃 环境 还可以 卫生 很好 一定 经常
7666,0,家人 一起 菜品 丰富 以后 还会 网上 团购 划算
7667,0,汉渝路 公交站 旁边 很好 找到 还可以 鸭头 不错
7668,0,味道 真的 很好 团团 份量 很足 他家 团购 几次 味道 一直 很棒
7669,0,位置 好找 口感 很好 新鲜
7670,0,两个 小时 送到 根本 没有 葱头 一根
7671,0,说实话 确实 两个 一袋 花生
7672,0,服务 很好
7673,1,老板 香酥鸡 ## 蜜辣 ## 奥尔良 真心 没熟 老板 希望 明天 拉肚子
7674,0,鸡翅 很嫩 两个 很饱 不错 实惠 鸡翅 耗儿
7675,0,味道 不错 干净 卫生 清淡 不辣 值得 一吃
7676,0,顾客 不错 划算
7677,0,味道 不错 服务 不错 中午 蛮少 张券
7678,0,蛋糕 好吃 号码 态度 太差 哪有 买家 发火
7679,0,差评 死难 目前 我点 外卖 难吃
7680,0,位置 有点 真的 划算 便宜 多次 两个 人团 张就够 基本 够吃 口味 有点 吃来吃去 三个 有点 希望 推出 几种 口味
7681,0,味道 不错 很快 值得 尝试
7682,0,味道 不错 两次 服务 非常 到位 难得
7683,0,味道 不错 汤是 骨头汤 推荐
7684,0,不错 挺好吃
7685,0,路过 偶然间 发现 咖啡 比例 应该 很好
7686,0,味道 纯正 环境 菜品 新鲜 精致 干净 卫生 服务态度 很好 汤圆 好吃
7687,0,干净 卫生 份量 很足 浓浓的 鲜族 风味 真心 不错 不好意思 泡菜 一上
7688,0,好吃 酸菜 有味 很饱 划算
7689,0,味到 还好 上菜 速度 还可以 继续 加油
7690,0,两份 一份 餐具 怎么吃
7691,1,豆浆 有点 馊了 觉得 差评
7692,0,难吃 难吃
7693,1,臭的 一口 全吐
7694,0,商家 太慢 超过 预期 分钟 收到 泡面 泡胀 联在 一起 胃口 没得
7695,0,不错 第二次 下次 还来 服务态度 没得说
7696,0,不错 比较 划算 味道 很好 物美价廉
7697,0,辣味 老板 人好 服务周到 女友 一个 小时 分量 很足 味道 不错 环境 不错 机会 下次
7698,1,不好吃 不新鲜
7699,0,很好 希望 不要 涨价 几次
7700,0,不错 两人 足够
7701,0,我定 蛋糕 时候 老板娘 亲切 蛋糕 样式 味道 好吃 强烈推荐
7702,0,顾客 味道 非常 店里 阿姨 热情周到
7703,0,味道 团购 划算 特色 纸包
7704,0,不错 朋友 一起
7705,1,钢丝 头发 钢丝 老板 平时 做菜
7706,0,牛排 味道 不错 分量足 老板 好好
7707,0,服务 很好 老板 也好 价格比 重庆 价格 稍微 味道 起来 一点 偏辣
7708,0,一如既往 分量足 味道 地方 有点 熟悉 不好
7709,0,好吃 第二次
7710,0,味道 凑合 速度 十一点半 下单 一点 拿到 只能 再也不会 这家
7711,0,闻到 真的 没话说 老板 很好 老板 生意兴隆
7712,1,非常 不够 难道 苍蝇 代替 真是 无语 看着 恶心
7713,0,肠子 叫鸡 干脆 肠子 干锅 好听 早点 倒闭 欺骗
7714,0,无语 以后 再也不会 外卖 态度 东西 送来 脏兮兮 倒胃口 恶心
7715,0,菜品 新鲜 味道 喜欢 分量足
7716,0,非常 好吃 喜欢 孜然
7717,0,说好 饮料 没得 渴死
7718,0,这家 烤肉 物美价廉 菜品 很多 新鲜 寿司 秋刀鱼 好吃 甜品 饮料 很多 推荐 性价比 之王 北京烤鸭 辣酱 日本 寿司 韩国 寿司 提拉 米苏 果汁 奶昔 可乐 汤圆 比萨 慕斯 蛋糕
7719,1,臭的 怎么吃 生气
7720,0,少送 一个 鸡肉 骨肉相连 最近 总是 少送 东西
7721,0,第二次 味道 不错 美女 热情 保持 下去 肯定 生意 火红 支持 店家 大大的 好评
7722,0,舌尖 顾客 味道 好吃 有空
7723,1,水果 不新鲜 奶油 不好吃 里面 蛋糕 不怎么
7724,0,从点 餐到 送到 半小时 完全 根本 没法 知道 肯定 早就 做好 没人接 麻烦 以后 清楚 重大 兰园 接单 方便 客户
7725,0,服务 真的 很好 看见 还可以 续杯 瓶子 漂亮
7726,0,非常 划算 味道 不错 单独 划算
7727,0,好喝 不要 不要 每次 一路 必买 一杯 现在 离开 重庆 想念 那种 味道
7728,0,弄乱 米饭 掺杂 一起
7729,0,菜品 不错 味道 排队
7730,0,已经 评价 多次 服务 特别 份量 很多 夏天 空调 舒服 不热 干净 卫生
7731,1,虫子 见图 卫生状况 堪忧
7732,0,一家子 套餐 完美 味道 超级
7733,0,送货 一样
7734,0,经常 过去 味道 一如既往 确实 好吃
7735,1,顾客 还给 搞些 劣质 水果 红提 臭味 弄出来
7736,0,服务 热情 菜品 丰富
7737,0,豆腐
7738,0,有点 环境 干净 份量 很足 外卖 用心
7739,0,第一次 服务态度 很好 味道 很好
7740,0,水木 天地 双龙 轻轨站 下边 十一 路口 坐电梯 上三楼 右转 找到 已经 第二次 木质 装修 舒服 店里 妹儿 态度 很好 推荐 红豆 茶味 雪花 甜甜的 沙沙 红豆 加上 清爽 雪花 细腻 好吃
7741,0,味道 不错 孩子 玩累 买份 挺香 里面 好像 很多 偷工减料 下次 改进
7742,0,菜品 比较 新鲜 服务态度
7743,0,依旧 满意 这次 超级 不该 下次 继续 小伙伴 一起
7744,0,菜品 服务 热情周到 下次 介绍 朋友
7745,0,味道 不错 服务态度 免费 酸梅 水喝 空调 环境 舒适
7746,0,菜品 吃不完 老壳 服务员 真他妈 热情 心跳 加速 完全 小菜 真的 多得很 一摞
7747,0,不错 很多 菜品 不错 甜点 好吃
7748,0,非常 满意 经常 全家 喜欢
7749,0,不错 不错 挺大 蛋糕 十多个 餐厅 提回去 早餐 哈哈哈 味道 还可以 那种 甜味 妹妹 好吃 图片 一摸 一样 不了 图片
7750,0,筷子 怎么吃 ....
7751,0,位置 好找 早就 想来 现在 终于 有空 过来 服务态度 很好 热情 口味 很好 很好 排队 分量 适中 米线 看起来 舒服 味道 真的 不赖 推荐 没吃过 试一下 几张 随意 感受一下
7752,1,干净 虾肠 虾头
7753,1,味道 肚子痛 拉肚子
7754,1,知道 流程 问题 撕开 袋子 不明 物体 袋子 肯定 餐厅 虫 上面 恶心 再也 不吃 麦当劳
7755,0,两个 蛋糕 桂香园 口感 很好 不会 特别 喜欢
7756,0,服务态度
7757,1,豆腐 变质 变味 诚信 经营 理念 下次 上当受骗 太差
7758,0,胶原蛋白 好吃 东北 惦记 菜菜 好吃 超级 机会 重庆 一定 胖胖 老板 以后 机会 再见
7759,0,挺不错 上菜 速度 比较慢 现场 方便
7760,1,鱼丸 不新鲜 异味 一口
7761,1,馊的 天气 几天 必要 留着
7762,0,不好吃 排骨 量少
7763,0,菜品 一如既往 好吃 服务 热情 一个
7764,0,非常 下次 还会
7765,0,好吃 每次 原味 芝麻 很棒
7766,0,米饭 太硬 感觉 锅底 剩饭 备注 不要 酱油 辣椒 肯定 不会 这家
7767,0,菜品 新鲜 服务态度 品味 不错 好评
7768,0,牛排 好吃 菜品 很多 早就 开始 排队 真多 哈哈哈
7769,0,难吃 爆炸 差评 差评
7770,0,味道 不错 实惠
7771,0,难吃 外卖 简直 不值 烧白 不值 不会 再来
7772,0,价格 实惠 味道 前台 小姐姐 服务 很好 服务员
7773,1,第一次 从来 没吃过 有酸味 黄焖 知道 你家 黄焖 味道 食材 变质 总的来说 不好吃
7774,1,别买 卫生 拉肚子
7775,1,酸辣粉 里面 一只 虫 恶心 照片 评论 不能 发图片
7776,0,我点 肉片 没有 加进去
7777,0,很好 菜品 特多 位置 方便 几次
7778,0,物美价廉 老板 很好 以后
7779,0,门口 团购 第一次 团比进 店购 划算 下次 继续
7780,1,脑花 直接 没有 烤熟 怎么吃
7781,0,好吃 位置 好找 上菜 速度
7782,0,难吃 丢掉
7783,0,正宗 牛排 几次 套餐 单点 价格 比较 实惠 喜欢 牛排 选择 这家 牛排 选择 值得 推荐
7784,0,味道 朋友 聚餐 不错 地方
7785,0,难吃 难吃 面连 盐都 寿司 白味 第一次 上当 一次 不会 第二次 应该 没有 回头客
7786,0,朋友 推荐 味道 不错 下次 还会来
7787,0,难吃 真的 米饭 菜全 剩下
7788,1,里面 头发 可怕
7789,0,菜品 丰富 味道 不错 环境 高大 非常 满意
7790,0,牛魔王 一如既往
7791,0,点过 .. 点才 拿到 .. 飞机 北京 ..
7792,1,雪碧送 没有 商家 电话 不通 几把 垃圾
7793,0,难吃 难吃 难吃 难吃
7794,0,经济 实惠 味道 下次 再来
7795,1,订单 不说 写错 人家 外卖 叔叔 拿错 回去 真的 饿死 一个 小时 出去 回来 敢不敢 认真
7796,0,大都会 这家 外婆桥 一直 不错 味道 很好 上菜
7797,0,味道 不错 感觉 份量 偏少 六个 最后 二百多 离家 太近 希望 越来越 起来 方便
7798,0,环境 不错 干净 态度 好吃 分量足
7799,1,饮料 送来 退钱 两天 不见 打电话 一直 敷衍 老板 必定 挣大钱 节约 哈哈哈
7800,0,味道 不错 上菜 速度 很快 阿姨 服务 很好 下次
7801,0,你家 盐巴 不要
7802,0,第一次 味道 非常 每天
7803,0,基本 一口 腥味 太重 难以 下咽 两百多 块钱 不值
7804,0,味道 很好 顾客 喜欢 值得 推荐
7805,1,以后 拉肚子 同学 千万 不要
7806,0,味道 团团 购快 现团现 付款 十分 方便
7807,0,没有 筷子 没有
7808,0,真的 超级 超级 难吃 非常 难吃
7809,0,难吃 东西
7810,0,总体 不错 划算
7811,0,经常 去年 菜品 很多 精致 味道 不错
7812,0,知道 几杯 好喝 继续
7813,1,两份 里面 虫子 卫生 堪忧
7814,0,难吃 垃圾 玩意儿
7815,1,银耳汤 里面 有虫 米饭
7816,1,一股 味道 一点 不好吃
7817,1,毛发 下去
7818,0,酸奶 紫米露 好喝 酸奶 好喝 冰冰
7819,0,味道 服务 环境 热闹
7820,1,麦嘉鸡 送过来 豪客 莱丝 恶心 肉串 臭的 估计 鸡米 花卖 拿来 送餐 配送费 月售 三百 单都 过来 建议 不要 商家 态度恶劣
7821,0,一如既往 地点 原味 紫米 酸奶 好吃 好吃 好吃 店员 服务 很好
7822,0,不错 适合 朋友 聚会 菜品 味道 很好 分量 下次 还会
7823,0,只能 重庆 人儿 好吃 第一次 过来 评价 美味 过来 失望 味道 很棒 鸭肠 毛肚 新鲜 菜品 分量 真的 实在 良心 商家 关键 服务态度 特别 老人 特别 热情 鲜鸭肠 鲜鸭血 毛肚
7824,0,味道 很好
7825,0,不好吃 甜甜的
7826,0,服务周到 味美 价廉
7827,0,咸又糊 亏了
7828,0,环境 不错 老板 很好 全程 完成 开始 担心 奶油 会腻 不好吃 哪里 知道 担心 多余 奶油 采用 鲜牛奶 打磨 而成
7829,0,好吃 实惠 芒果 好吃 经常
7830,0,不想 一如既往 一个
7831,0,地理位置 特别 好找 里面 老板娘 服务态度 特别 特别 热情 老乡 菜品 十分 新鲜 种类 海鲜 种类 多一点 蔬菜 干净 没有 脏东西 特别 一次 美团 体验 还会
7832,0,味道 不错 价钱 便宜 很大 一条 老板 服务 也好
7833,0,味道 服务员 少拉点 位置 好找
7834,1,差评 汉堡 没熟 不动 知道 不会 拉肚子
7835,0,酸奶 不错 确实 不惯 黑米 黑米 难吃 觉得 好吃 每个 口味 不同
7836,0,味道 环境 七夕 生意 很好 老板 没有 一点 不耐烦 满分 一分 更好
7837,0,味道 非常 不错 价格 便宜 代金 划算
7838,0,印度 飞饼 商家 图片 骗人 飞饼 差距 太大 难吃 无语 真的 难吃
7839,0,味道 很好 喜欢 继续 支持 支持
7840,0,份量 很足 味道 十一个 一桌 够吃
7841,0,一如既往 顾客 还会
7842,0,环境 很好 凉面 好吃 味道 很好 下次
7843,0,吃货 几次 不错 日理万机 睡觉 民工
7844,0,简直 多到 生意兴隆 菜品 味道 很好
7845,0,环境 超级 喜欢 闺蜜 男票 地方
7846,0,骗人 米饭 没有 不行
7847,0,黄金 手枪 霸道 哈哈哈哈 常客 服务态度 很好 汉堡 好吃 鸡肉 好吃 手扒鸡 脆皮 炸鸡 好吃 大块 分量 可乐 加冰 好喝 老板 很好 学校 方便
7848,0,这次 一点 不好 香肠 烤糊 小馒头 入味 不好 香菜 没烤
7849,0,味道 不错 环境 花样 好看
7850,0,环境 多种 东西 选择 米线 非常 好吃
7851,1,烧白 臭味 生意 老板 注意 食材 选购
7852,0,牛排 味道 不错 海鲜 种类 比较 铜梁 算是 比较 海鲜 自助
7853,0,分量足 服务 水果
7854,0,难吃 米饭 冷硬带 锅巴 四口
7855,0,两份 土豆片 一片
7856,0,菜品 一如既往 需要 位置 建议 早点 排队
7857,1,藕片 打开 一根 头发 恶心 直接 倒掉 恶心
7858,1,汤圆 里面 蚊子
7859,1,四季豆 完全 没有 没熟 情况 食用 导致 胃肠 充血 食物中毒
7860,0,重庆火锅 名不虚传 味道 非常 材料 非常 新鲜 真的 好吃
7861,0,性价比 味道 不错
7862,1,里面 飞虫 郁闷 郁闷
7863,1,真的 难吃 肌肉 像是 变质 一样 一股 死鱼 臭味 知道 哪来 勇气 炸鸡 店贵 雪碧是 摇过 汽水 糖水 重点 天雪碧 送来 时候 一点 冰不加 留点 配送 体温
7864,0,味道 不错 老板 服务 很好
7865,0,味道 还可以 第二次
7866,0,家人 聚会 定点 地方 已经 好几年 菜品 一如既往
7867,0,还可以 几次 推荐 常去
7868,0,不错 第二次 以后 还会
7869,0,虎虎 火锅 真的 味道 非常 巴适 真的 非常 非常 网评 火锅 味道 好吃 还可以 免费 停车 新鲜 份量 老板 非常 非常 热情 已经 熟客 现在 打电话 火锅 佐料 熬起 真的 太巴适 过来 直接 开整 方便 味道 位置 停车 方便 份量 火锅 首选 虎虎 火锅 不得 错过 重庆 味道
7870,0,味道 不用说 一如既往 好吃 够味 服务态度 比较 速度 超赞
7871,0,差评 考鸭饭 烤鸭 没有 饮料 卤蛋 没有
7872,0,难吃 再也不会
7873,0,一如既往 好吃 老麻 真的 很赞 老板 超级
7874,0,特别 划算 鸡蛋 好吃
7875,0,非常 好吃 味道 同事 聚餐 觉得 好吃 好多 家人 再来
7876,0,第二次 购买 味道 一如既往 团购 价格 越来越
7877,0,味道 不错 图片 实物 区别
7878,0,服务 两次 再也 不买 第一次 差瓶水 这次 一个 小时
7879,0,味道 不错 服务 很好 一次 公司 同事 好喝
7880,0,火锅 干锅味 难吃
7881,1,不送 上楼 苍蝇
7882,0,味道 不错 下次 还会 光顾 推荐 尝尝
7883,0,非常 好吃 蛋糕 很香 推荐
7884,0,送来 排骨 欺骗 拉塞 排骨 没有 看到
7885,0,不起 活动 不要 新店 开张 居然 顾客 好多 好多 告诉 我点 外面 太假 希望 不要 知道 原价 点会 两个 骗人
7886,0,配送 速度 实在 太慢 味道 明明 中辣 一点 辣味 没有
7887,0,鲜味 老板娘 热情 看看
7888,0,大盘鸡 以后 不要 打着 新疆 大盘鸡 名号 骗人
7889,0,服务 周到 味道 很好 分量 很足
7890,0,几次 觉得 不错 朋友 起来 菜品 很多 新鲜 网上 进店 交钱 小孩 收费 想想 舒服 一个几岁 小孩 希望 改善 环境 不错 位置 好找 扶梯 旁边 唉呀 总算 凑够
7891,0,味道 非常 老板 很好 冰加少 建议 下次 免费送 一杯 服务 超级 下次 还会
7892,0,晚上 小区 里面 电话 找到 老板娘 热情 环境 不错 餐位 菜品 很多 味道 很好 老公 喜欢 蓝莓 山药 喜欢 菠萝油 沙拉 感觉 奇特 牛排 很好 意面 好吃 中西餐 感觉 不错 喜好 满足 盘子 图案 老板娘 现画
7893,0,味道 还行 进门 服务员 热情 招待 本来 预定 后来 工作人员 调节 一下 个个 很好 位置 菜品 丰富 很饱 甜品 小吃 中餐 火锅 饮料 相对 选择 乐堡 很好 希望 更好
7894,1,钢丝 评论
7895,0,好吃 去过 几次 希望 以后 店面 扩一扩 哈哈
7896,0,味道 生意 太好了 每次 排队 很快 服务态度 也好 帮忙 吸管
7897,0,一如既往 好吃 顾客 味道 不错 还会
7898,0,活动 期间 人多 味道 超好 喜欢
7899,0,微辣 结果 里面 很多 海椒 起码 中辣 商家 接单 结果 骑手 接单 我要 饿死
7900,0,非常 不错 限量 虾饺 好多个 性价比 超高 特别 每个 点心 几个 喜欢 多来 几个 固定 一盘 几个 人少 环境 优选 1.2 以下 小朋友 免费 剔除 喜欢 试了试
7901,0,味道 一般 没有 米饭 看到 单点 米饭
7902,0,几次 好喝 强烈推荐
7903,0,味道 老板 服务 很好
7904,0,太咸 干撒撒 不好吃
7905,0,环境 不错 适合 朋友 聚餐 总的来说 分量 没有 比较 精致 接近
7906,0,太慢 今天 整整 一个 小时 饿死
7907,0,味道 干净 卫生 送货 准时 顾客
7908,0,服务 味道 可选性
7909,0,菜品 服务 今后 品尝
7910,0,味道 很好 干净 服务 也好 好吃 便宜
7911,0,比较 很多 火腿 豆芽 金针菇 番茄 主要 感觉 非常 美味 排骨汤 确实 不错 哈哈 很大 一碗 单独 有点 吃火锅 感觉 哈哈 比较 心急 不了 热豆腐 慢慢 品尝 鲜美 值得 下次
7912,0,不错 第二次 值得 推荐
7913,0,找不出 不好 地方 老板 特别
7914,0,味道 很好 特别 环境 永川 大排档 环境 最好 还可以 看球赛 值得 推荐 还会
7915,0,绝对 香辣 绝对 好吃 事实 说话 后悔 下次
7916,0,超级 不满意 饿死
7917,0,老板 态度 很好 分量 很足 便宜
7918,0,味道 服务周到 便宜 实惠
7919,0,第二次 好吃 蛋糕 很漂亮 价格 实惠 一如既往 侄儿 喜欢 喜欢 特别 谢谢 老板 不到 情况 坚持 送到 餐馆 辛苦 谢谢 老板 以后 需要 一定 捧场 介绍 朋友
7920,0,好吃 份量 下次
7921,0,难吃 两口
7922,1,打开 一口 知道 亮点 一条 虫 打开 虫 开始 往外 店家 打电话 过去 重做 问题 食欲 问题 一口 进去 现在 处理 已经 桌上 虫子 店家 回复 可能 干净 只想 恶心
7923,1,一半 一只 蟑螂 恶心
7924,0,地方 不太好 以外 很棒
7925,0,味道 很赞 地方 好找
7926,0,喜欢 奶茶 量足 味道
7927,0,还可以 价钱 合适 朋友 一起
7928,0,配菜 不错 精致 好吃 一致 好评
7929,0,价格 实惠 菜品 不错 新鲜 喜欢 还会
7930,0,好求 难吃 饿死 难吃 抓狂
7931,0,喜欢 环境 还行 有点 味道
7932,0,方便 我家 楼下 感觉 团购 划算
7933,0,严重 差评 饿死 抄手 送来 喊一声 放在 前面 桌子 上放 半天 同事 厕所 看到 气死我了 一直 没到
7934,0,搜美团 附近 美食 发现 这家 立马 不少 人家 津津有味 直接 团购 老板娘 一样 热情 招待 团购 现点 一样 这点 不错 确实 现称 公鸡 现点现 一会儿 特别 推荐 尖椒 面筋 非常 好吃 打包 回家 服务 不错
7935,0,多次 总体 很好
7936,0,舒服 环境 很好 闺蜜 小聚 老板 人好 价格 合理 推荐 推荐
7937,0,经常 宴请 必定 地方 位置 停车 方便 服务员 热情 好吃 太棒了
7938,0,不好吃 买来
7939,0,几次 不错
7940,0,不错 样式 不错 服务态度 不错 准备 麻烦
7941,0,地方 好找 味道 不错 价格 优惠
7942,0,提前 同学 一起 小米 不错 只不过 晚上 女生 不怎么 尽兴 哈哈哈
7943,0,非常 好吃 第一次 今天 第二次 味道 不错 环境 很好 卫生 机会 容错过 吃货 一定 要来 下次 还会 朋友 光顾
7944,0,不错 不错 附近 终于 有家 味道 不错 奶茶
7945,0,口味 很好 外形 好看 几次 不厌
7946,0,很棒 几次 满意 非常 喜欢
7947,0,味道 很好 经常 四人餐 分量 很足 五个 女生 一份 年糕 烤肉 吃饱
7948,0,蛋糕 美味 服务 很好
7949,0,老板 用心 一直 口味 很好 环境 不错 关键 味道 面汤 牛肉汤 还会
7950,0,中午 吃饭 好去处 人多 味道
7951,1,东西 不好吃 异味 东西 送错 菜品
7952,0,多次 味道 一如既往 地好 下次
7953,0,味道 下次 还来
7954,0,第二次 没想到 失望 酸菜 滑肉 一块 没有 鸡脚 好吃 味道 酸菜 滑肉 ## 卤鸡
7955,0,好喝 感觉 每次 忍不住 有时候 忍住 哈哈 好喝 上瘾 饮料
7956,0,服务 很好 没有 美团 顾客 怠慢 味道 很好
7957,0,环境 挺不错 卫生 宽敞 每次 服务态度 不错 好吃 爽脆 份量
7958,0,菜品 味道 过关 总体 非常 不错 老板 热情 今天 晚上 谢谢你们 提醒 摩托
7959,0,好大 一个碗 味道 很好 相当 好吃
7960,1,寿司 什锦 几乎 全是 生菜 难吃 浪费 二十多
7961,1,送来 臭的 真的 这种 关门
7962,1,难吃 味道 密滋 鸡腿 有点 臭味
