,label,comment
2474,0,不好 面皮 很差 食欲 切片 太厚
2475,0,一如既往 喜欢 汉拿山 烤肉
2476,0,元气 乌龙 珍珠奶茶 点赞 每次 好喝
2477,0,不错 味道 很好 分量 很足 服务 很好 团购 5.8 块钱 划算 赠送 饮品 太辣 不怎么 厉害 喜欢 绝对 不能 错过
2478,0,老板娘 很好 值得 一去 小店
2479,0,第三次 依然 好吃 请客吃饭
2480,0,真心 不好吃 不会
2481,0,味道 比较 鲜美 分量 只能 一般
2482,0,第二次 实惠 分量
2483,0,菜太少 环境 还好 一点 希望 出自 回头客
2484,0,味道 不错 口味 很多 选择 团购 比较 实惠
2485,0,老板 服务 超级 热情 介绍 烤鱼 好吃 香辣 三个 适合 四个 下次 还会来 好吃 划算 推荐 推荐
2486,0,挺不错 时候 很少 窗边 朋友 聊天 惬意
2487,0,不错 牛肉 新鲜 下次
2488,0,服务态度 很好 送来 时间 不长 好评
2489,0,微辣 汤锅 觉得 特别 菜品 特别 新鲜 值得 推荐 牛肉 排骨 南瓜 和芋 特别 好吃
2490,0,廉价 几次 份量 很足
2491,0,不错 去过 几次 残疾人 服务 不比 一般 服务员
2492,1,小炒 臭的 小炒
2493,1,今天 咖喱 猪扒 臭的 朋友 一口 黄瓜 里面 钢丝 三份 两份 问题 心碎
2494,0,味道 服务 很好 卤肉饭 超级 好吃 虾油 有点
2495,0,便宜 味道 很好 服务 很好
2496,0,酸辣粉 味道 正宗
2497,0,不错 同事 聚会 去过 几次 菜品 丰富
2498,1,晚上 知道 东西 拉肚子 难受 卫生
2499,0,说好 饮料 结果 里面 没有 东西 真的
2500,0,好吃 价格 便宜 更好
2501,1,老板 皮蛋 臭了 弄出来 好意思
2502,0,朋友 推荐 鸡排 大块 分量足 朋友 聚会 吃得饱 路过 时闻 香味 忍不住 兑换 一份 鸡排 现烤 需要 几分钟 辛苦 几位 小帅哥 烤炉 不停 工作
2503,0,味道 不错 位置 很难
2504,0,味道 不错 整体 看起来 美观 挺快
2505,0,一如既往 好吃 还会 回去 尝新 口味
2506,1,沙拉 食材 不新鲜 西兰花 馊了 好多 味道 沙拉 第一次 遇到 食材 必须 差评 完全
2507,0,长假 老公 过生 一家人 难得 聚在一起 今天 下雨 离家 很近 可能 今天 长假 店堂 坐满 感觉 有点 闹麻 牛肉 味道 不错 很鲜 服务员 有点 态度 很好 推荐 刀叉 牛肉 泡脚 锅巴 牛肉
2508,1,之前 一直 这家 前天 以后 拉肚子 最惨 现在 一天 医生 干锅 宫保鸡 留下 继续 化验 非常 郁闷
2509,0,只能 完全 黔江 鸡杂 名头 不多
2510,0,米线 外卖 时间 送过来 米线 都化 好吃 不好吃 麻烦 点心 做生意
2511,0,一如既往 好吃 每次 家里 有人 生日
2512,0,老板 热情 店子 味道 非常 实惠
2513,0,去过 几次 喜欢 味道 很好
2514,1,无良 商家 排骨 排骨 臭的 臭得 熏天 恶心
2515,0,不好吃 不好吃
2516,0,不错 经常 喜欢 哈哈哈哈
2517,0,不错 速度 很赞 性价比
2518,0,本来 便宜 用券 划算 棒棒
2519,0,味道 不错 真正 火锅 服务 相当
2520,0,简直 差评 凌晨 点点 外卖 软件 显示 点到 凌晨 点多 送到 骑手 点多 老板 打电话 多次 塘塞 吃个 宵夜 晚上 睡觉 态度 生意
2521,0,顾客 经常 便宜 味道 不错 打麻将
2522,0,特色 香辣 泡椒 鸡杂 味道不好
2523,0,热得 好喝 面包 好吃
2524,0,好吃 下次 服务
2525,0,不想 一个
2526,0,第一次 味道 拉肚子 好评 辣椒面 简直 干油
2527,0,垃圾 鸡翅 黑色 不动 可乐 没有 气泡 要命
2528,0,环境 还可以 味道 很好 顾客 忙不过来 团购 柜台 点餐 感觉 舒服 希望 改进 一下 还好
2529,0,没有 按时 送达 态度恶劣 退款
2530,0,不错 不错 保持 价格 经常
2531,0,服务态度 很好 短发 比较 可爱
2532,0,分量 几个 去掉
2533,0,锋邸 背后 那条 旁边 豪客来 店子 四张 还好 比较 上菜 挺快 大概 两个 年轻人 分量 其实 挺足 鸡翅 值得 推荐 应该 稍微 烤烤 特别 讲真 外面 专门 鸡翅 好吃 相比之下 比萨 逊色 夏威夷 考虑 些小 青椒 肉酱 有待 加强 太干 感觉 拌面 没有 汤汁 整体 实惠 超值
2534,0,环境 安安静静 顿饭 品味 不错
2535,0,一如既往 好吃 棒棒 快来
2536,0,价格 位置 服务 不错 美团网 团购 开发票
2537,0,菜量 很足 味道 非常 经常
2538,0,味道 不错 第二次 第一次 两人团 三人餐 这次 四人团 六人餐 刚好
2539,0,真的 送到 啤酒 烧烤 烧烤 上次 差距 特别 一点 没得 难吃 送得 再也 不点
2540,0,差劲 根本 难以 入口
2541,0,味道 真正 没有 特色 咸和 孜然 极小 门口 烤鱼 味道 真心 不能 点赞 上菜 环境 服务 不错
2542,0,不好吃 超级 难吃
2543,0,味道 以前 经常 这家 羊肉 汤锅 本来 今天 板栗 没有 烤鸭 烤鸭
2544,0,味道 不错 三鲜 朋友 牛肉
2545,0,生意 好人 很多 菜品 比较 丰富
2546,0,很好 两个 完全 好多 味道 不错 水果 汤水 自助 真心 不错
2547,0,好吃 一如既往 好吃 小宝宝 长大 越来越 可爱 生意兴隆
2548,0,重庆 第一家 烤鱼 味道 正宗 环境 优雅 卫生 干净
2549,0,味道 一级 锅底 配菜 丰富 服务周到
2550,0,蛋糕 很漂亮 包装 挺不错 价格 比较 便宜
2551,0,环境 很好 有大有 干净 舒缓 音乐 伴奏 烤生 速度 很快 各种 中餐 小吃 西餐 牛排 面包 蛋糕 味道 不错 好吃 鸡尾酒 起码 十几杯 战斗力 不行 一点点 下次 还会来
2552,1,已经 这家 几次 一次 居然 两根 头发 刺身 寿司 经营 日本料理 居然 出现 这种 极度 倒胃口 情况 相信 厨房 脏乱差 讲卫生 恶心 以后 不会 光顾
2553,0,不错 味道 还可以 服务 周到
2554,0,几次 服务周到 菜品 齐全 周末 每个 人要 五块
2555,0,已经 多次 划算 好吃 朋友
2556,0,味道 真的 不错 特别 很香 名不虚传
2557,0,十二个 人去 一点 很饱 划算
2558,0,服务 一点 不好 上面 备注 乐不放 辣椒 结果 送来 麻又辣 接单 时候 超级 差评
2559,0,王哥 红烧 肥肠 酸菜 肉丝
2560,0,味道 确实 没话说 价格 确实 偏贵
2561,0,顾客 多次 有时候 人多 上菜 很慢 希望 上菜 快点
2562,0,味道 很好 价位 便宜 服务 满意
2563,0,非常 不好吃 味道不好
2564,1,东西 已酸 夏天 变质
2565,0,很好 老板 ..
2566,0,服务
2567,0,味道 不错 分量 充分 值得 一试
2568,0,从来 没有 一次 点个 外卖 生气 本来 十一点 四十 差不多 下课 之后 结果 一直 等到 一点 四十 送来 催过 一次 商家 回复 不想 申请 退款 打个 电话 哈马 上来 取消 退款 真的 搞不懂 我为 哈子 一份 需要 两个 小时 图片 鸡翅 真的 不想 商家 好自为之 不会 再点
2569,0,服务态度 上菜 速度 超级 口味 一流
2570,0,不错 一如既往 味道 下次 还会
2571,0,分量 最足 牛肉面 牛肉 超大 一坨
2572,0,皮蛋 瘦肉粥 骗人 nbsp 根本 没有 味道 nbsp 普通 米粥
2573,0,告诉 六寸 42.8
2574,1,超级 小盒 这点 三十多 以前 份量 三十多 买好 多种 水果 越来越
2575,0,突尼斯 软籽 石榴 店家 骗人 没吃过 软籽 石榴 做生意 价格 不起 活动
2576,0,时间 不准 送得 及时 送到 米线 肥肠 米线
2577,0,试一试 心态 主要 老公 披萨 相当 喜欢 这次 披萨 终于 改观 口感 相当 不错
2578,0,总得来说 不错 服务 人员 很好 可能 有点
2579,1,昆虫 里面
2580,0,去过 多次 态度 很好 热情 口味 也好
2581,0,店员 热情 口味 很好
2582,1,土豆 藕片 锁骨 异味 多年 绝味 垃圾 一家 希望 上当
2583,0,第二次 味道 鸭子 不算 肥腻 服务态度 很好
2584,0,味道 不错 几次
2585,0,不好吃 感觉 非常 一般
2586,0,顾客 很好
2587,0,鲫鱼 好吃 份量 很足 八个 没有 老板 不错
2588,1,串串 土豆 变质 黑心 商家
2589,0,华夫饼 鲜榨 柳丁 味道 环境 安静 服务周到
2590,1,味道不好 卖相 感觉 像是 打包 一样
2591,0,不想 左右 现在 预计 送达 一个 小时 以后 再也不会
2592,0,想象 特意 一个 停车 方便 环境 不错 麻将 收费
2593,0,经常 口味 一如 即往 值得 推荐
2594,0,性价比 极高 味道 很好 值得
2595,0,同事 一起 味道 不错 环境 也好 四人餐 完全 够吃 很多
2596,0,送得 超级 超级 超级 无敌
2597,0,我要 孜然 烤肉 孜然 白肉 难吃 要死
2598,0,店员 热情 团购 非常 划算 推荐
2599,0,老板 帅气 大方 主要 味道 很好
2600,0,这家 味道 很好 分量足 还会 芋儿 烧鸡
2601,0,总体 很好 收银员 态度 需要 培训 一下
2602,0,服务员 态度 很好 非常 不错 强烈推荐
2603,0,几次 味道 不错 喜欢 环境 不错
2604,0,喜欢
2605,0,味道 太棒了 服务 环境 很好 推荐
2606,0,脑花 全是 泡椒 没有 一块 成型 泡椒 锡纸 脑花 ## 豆干 ## 韭菜 ## 海带 折扣 啥子 偏偏 一点 油水 没得 没吃过 难吃 烧烤 心情 鬼火 本来 商家 好评 真的 冒火 脑花 没有
2607,0,味道 地道 菜品 新鲜 各种 活动 手机 火锅店 感谢 拾金不昧 下次 回来 已经 会员
2608,0,好吃 每次 留香 排骨 ....
2609,0,说真的 不会 第二次 下单 点半才 送到 送到 火星 送过来 一点 不好吃
2610,0,好吃 江湖 大爱 无意间 发现 小虫子 老板 注意
2611,0,想象 中的样 上面 一点 好看 店好 失望
2612,0,愉快 一次 聚餐 口味 还行 关键
2613,1,红烧肉 套餐 我爸 肚子疼 头晕 鸡蛋 豆豆 是不是 很久
2614,0,分量 很足 鸭子 没有 想象 好吃
2615,0,到极点 再也 不想 第二次 鸡杂 干锅 看到 鸡杂 一点 鱿鱼 骗人 干锅 鸡杂 点儿 鱿鱼 鱿鱼 鸡杂 没有
2616,0,味道 一如既往 服务 不错 貌似 价格
2617,0,味道 不错 菜品 新鲜 服务 下次 还会
2618,0,环境 优雅 服务 很好 味道 真的 很好 真要 便宜 好多
2619,0,三人 新鲜 吃不完 服务员 态度 很好 希望 出点 人餐
2620,0,真是 失败 一次 外卖 点餐 时候 系统 该付 商家 打电话 要求 我到 餐后 骑手 再付 块钱 想到 骑手 容易 答应 米饭 商家 加个 米饭 这点 米饭 好意思 送个 咸菜 之类 辣椒 一盆 油水 看不到 一点 从来不 喜欢 差评 今天 确实 高兴
2621,0,鸡丝 根粉 米饭 单点 酸得 一批 像是 感觉 米饭 单点 脖子 全是 脖子
2622,0,肉片 块钱 一片 没有
2623,0,喜欢 一家 好多好多 便宜
2624,0,不错 第二次 香辣 味道 超好 朋友 觉得 不错 老板 很好 推荐
2625,0,乔迁 新居 订餐 菜单 菜品 供应 不上 店家 几次 电话 确认 进行 同等 价位 菜品 改动 服务态度 一级 没有 团购 怠慢 服务 两百多 味道 很好 分量 用餐 环境 不错 推荐 订餐
2626,1,芝士 奶茶 恶心 奶茶 黑色 小虫 一口 发现 难受 ... 卫生 ...
2627,0,一个 蛋糕 非常 好吃 性价比 推荐
2628,0,好大 鸡排 感觉 店要
2629,0,送餐 不到 沟通 困难 没有 收费 这家 坑人 希望 不要 这家 后患
2630,1,凉皮 难吃 打开 盖子 眼睁睁 看到 一个 小虫 忍住 一口 买过 几次 原来 买面 觉得 不错 凉皮 一般般
2631,1,饭菜 完全 馊的 打开 整个 办公室 臭味 联系 店家 态度 超级 直接 垃圾桶 再也不会
2632,0,好吃 一家 火锅 服务态度 很好 菜品 新鲜 满意 味道 口感 不错 值得 一吃
2633,1,满心 期待 结果 居然 变质 发霉 一般 水果 榴莲 强烈要求 重新 更换
2634,0,上菜 很快 分量 服务 到位 性价比
2635,0,蛋糕 很漂亮
2636,0,消费 多次 速度 口味 质量
2637,1,准备 开始 一根 头发 请问 干净 哪里 影响 食欲
2638,0,味道 不错
2639,0,蛋糕 叉子 勺子 拿手 物品 顾客 沟通 迟到 半个 小时 勺子 半个 小时 再也不会 老婆 难吃
2640,0,分量 太少 坑爹
2641,0,还可以 味道 不错 尤其 好喝 适合 冬天 滋补
2642,0,味道 很好 比较 环境 更是
2643,0,打电话 订餐 客服 态度 很差 沟通 困难 费劲 不向 客户 介绍 客户 清楚 事情
2644,0,很好 外带 整整齐齐 披萨 口味 不错
2645,0,顾客 菜品 环境 服务 方面 不错
2646,0,竹荪 图片 完全 不同 里面 有烂 碗豆 洋玉 豆皮 黄瓜 黄秧白 搞搞 大锅 看起 胃口 第一次 差评
2647,0,两个 人去 四个 分量 完全 吃不完 违反 还行 服务 周到 好评 好评 环境 气氛 第一次
2648,0,简直 好吃 枉费 大老远 轻轨 公交车 找到 以后 持续 发展 服务 很棒 旁边 知道 串串 收费 知道 串串 纠结 半天 老板 超级 耐心 解释 好久 点赞
2649,0,店铺 位置 星天 广场 入口 进去 中部 位置 店面 生意 不错 老板 验证 团购 上餐 速度 团购 香香 杂酱面 味道 不错 拌面 类型 确实 很香 不负 香香 面之名 团购 价格 适中 下次 还会
2650,0,这家 味道 不错 几次 环境 很好
2651,0,味道 正宗 想要 酸酸 辣辣的 味道 酸笋 酸豆角 好吃 豆腐 喜欢 里面 螺狮 没有 南坪 一家 方便 下次 还会
2652,0,服务 跟上 更好 希望 改进 经常
2653,1,昨天 一天 一顿饭 这家 外卖 没有 凉水 没有 冰棒 拉肚子 昨天 时候 鱼香肉丝 一股 味儿 特别 不新鲜 像是 外面 肉丝 真的 差劲
2654,0,结果 送货员 非常 态度 不好
2655,0,不错 牛排 口味 很好 已经 去过 多次 就餐 朋友 吃饭 水果 沙拉 芒果 饮料 口感 非常 牛排 很快 服务员 态度
2656,0,味道 不作 评价 外观 很漂亮 孩子 喜欢
2657,1,鸡肉 臭的 无良 商家
2658,0,还可以 地方 好找 干净 卫生
2659,0,重庆 新店 不错 味道 正宗 推荐 店家 服务 非常
2660,0,老板 服务 热情 不错 不错
2661,0,服务态度 菜量 值得 推荐
2662,0,骗人 台湾 凤梨
2663,0,口味 不错 分量 很足 完全 没有
2664,0,味道 很好 下次 还会 这次 泡椒味 味道 有点像 鱿鱼 西施
2665,0,虾子 没有 平常 那种 油焖 大虾
2666,1,打开 看到 头发 干净 米饭 太硬 应该 那种 一股 知道 味道 一口 盐太多 全倒 简直 浪费
2667,0,我要 香菇 鸡饭 送来 晓得
2668,1,鸡蛋 上面 发现 一根 头发 nbsp nbsp nbsp 羊肉 散碎 nbsp nbsp 餐厅 没得 一张 nbsp nbsp nbsp 比起 正中 羊肉 一大截 nbsp nbsp nbsp
2669,0,面包 味道 每天 买来 早饭
2670,0,口感 很好 好吃 推荐 朋友
2671,0,不送 上楼 女孩子 上楼
2672,1,夜宵 第二天 拉肚子 一个 星期 结果 急性 肠胃炎 搞笑
2673,0,味道 还行 整体 分量
2674,0,一如既往 不错
2675,0,难吃 真心 难吃 美团 难吃
2676,1,顿饭 真的 冒火 提前 不能 送到 楼下 外卖 小哥 打电话 寝室 下去 从九栋 重电苑 收都 收拾 外面 不想 出去 外卖 小哥 不停 打电话 穿衣服 搞笑 结果 下去 一个 寝室 下去 结果 保安 不让 学校 里头 看到 别个 外卖 送到 楼下 感觉 真的 搞笑 吃个 饭点 外卖 劳资 食堂 真的 冒火
2677,1,米饭 馊的
2678,0,去过 多次 一如既往
2679,1,变质 鹌鹑蛋
2680,0,店老板 十分 热情 待客 温和 验卷 码到 上菜 挺快 进餐 各项 服务 周到 使人 进餐 心情 十分 舒心 麻辣 小锅 足够 享用 份量 价格 合理 算得 麻辣 制做 色彩 诱人 香味 迷人 入口 爽歪歪 鱼肉 细嫩 入味 配菜 好吃 唯一 厅堂 显得 有点 拥挤 影响 进餐
2681,0,灰常 好吃 不错 味道 几家 好吃
2682,0,超级 超级 喜欢 喜欢 三文鱼 刺身 鱼籽 寿司 秋刀鱼 推荐
2683,0,味道 一点 不好吃
2684,1,真他妈 恶心 头发
2685,0,打折 便宜 味道 平时 一样 下次 团购 划算
2686,0,很棒 很棒 很棒 老板 细心 材料 新鲜
2687,0,还好 味道 不错 第一次 不能 第二次 买好
2688,0,超级 难吃 香酥 不腻 幸福 单人 套餐 ## 山城 啤酒
2689,0,一个 外卖 分钟 多久
2690,0,味道 不错 学校 很近 休息 时候 顺便 一下
2691,0,一如既往 价格公道 味道 不错 值得 拥有
2692,1,太辣 拉肚子
2693,0,一个 小时
2694,1,越来越 不好吃 一点 味道 没有 不甜 夹生 里面 有点 不熟 注明 鸡肉 卷要 放菜 结果 没放 一样 鸡腿 不错 这次 番茄酱 众多 一份 商品 一顿 午饭 吃饱 回事 吃得开 不熟 漏放 不好 点心 至少 工作 到位 改进
2695,0,态度 很好
2696,0,环境 地段 不错 昨天 朋友 一起 觉得 味道 菜色
2697,0,非常 物超所值 朋友 介绍 第二次
2698,0,东西 一份 故意 米饭 结果 里面 没有
2699,0,非常 老板 热情 以后 还会来 光顾
2700,0,已经 第一次 每次 感觉 特别 舒服 店里 环境 棒棒 食材 特别 新鲜 上菜 速度 服务员 非常 热情
2701,0,难吃
2702,0,菜品 非常 新鲜 服务 不错 人气
2703,1,竟然 看见 蟑螂 很无语 招牌 牛肉 抄手
2704,0,分量 非常 味道 很好 下班 冲过去
2705,0,味道 臊子 好吃 独特
2706,0,非常 一直 这家 烤肉 菜品 特别 新鲜 喜欢 他家 鲜虾 牛肉
2707,0,特别 喜欢 平时 米线 一样 花甲 米线 鸡杂 米线 特别 好吃 主要 相对来说 特别 味道 米线 看到 小店 各种 龙利鱼 下次 试试 龙利鱼 泡饭
2708,0,味道不好 重庆 鲜椒
2709,0,味道 不错
2710,0,味道 不错 值得 第二次
2711,0,爽口 酸奶 紫米 口感
2712,1,啥子 东西 蛐蛐 拉肚子
2713,0,不错 下次 还来
2714,0,我点 两份 一个 勺子 一点 不好吃 甜酒 难吃 差评 不会 他家 东西 难吃
2715,0,服务 热情 上菜 速度 非常 口味 不错
2716,1,今天 排骨 臭的 真的 不新鲜
2717,0,明明 一碗 米饭 结果 没有 好久 快要 饿死 送来
2718,0,服务态度 美团 直接 菜品 大爱 值得
2719,0,不好吃 一口
2720,0,不错 环境 拥挤 几次
2721,0,中午 服务周到 酸奶 好吃 羊肉 烤肉 不错
2722,1,麻辣 牛肉 一次 拉肚子 一次
2723,1,没有 nbsp 馊的 nbsp 怎么吃 干水
2724,0,服务 热情 上菜 很快 还会 主动 询问 加菜 比上 一次 好吃 菜品 比较 新鲜 还会
2725,0,长期 味道 不错 特别 用券 划算 正价 比较
2726,0,差评 准备 全都 辣椒 千层
2727,0,经常 一家 非常 不错 还会来
2728,0,店里 牛肉 真的 重庆 最大 牛肉 土炮 味道 杠杠
2729,0,划算 很足 味道 不错
2730,0,非常 满意 环境 很好 味道 一如既往 价格 划算
2731,0,异乡 黄金周 中秋节 实在 有点 凄凉 兜兜 转转 两个 小时 最后 来到 吃饭 今天 开心 一个 事情
2732,0,不错 有点 有点
2733,0,双皮奶 便宜 好吃 满意 一次 团购
2734,0,味道 不错 价格 便宜 使用 美团 买单 方便
2735,0,一个半 小时 不好吃
2736,0,好吃 好吃 位置 很好 轻轨 旁边
2737,0,UME 电影院 旁边 电影 时候 小时 面包 味道 不错 内软 酸梅 气泡 还可以 还会
2738,0,不错 几次
2739,0,漏油 袋子 里面 全是 一个 小时
2740,1,尼玛 吓一跳 差点 苍蝇 当成 蚊子 这是 情况 卫生 第一次 喝粥 里面 苍蝇 一只 老客户 卫生 不能 到位 一点 真的 .... 有图 真相
2741,0,服务 黑好 性格 有说有笑 人家 验证 使用 程序 需要 时间 办理 应该 理解 还会 这家
2742,0,很好 喜欢 真的 划算 啊啊啊 太棒了 下次
2743,0,很好 口感 很好 环境 服务 脑花 大赞 菜品 新鲜 大爱 每次 好多
2744,1,真的 超级 难吃 没有 室友 另一家 冒菜 没有 没有 伤害 希望 不要 拉肚子
2745,1,一双 筷子 厉害 怎么吃 打开 一根 头发 上面 味道 知道
2746,0,蛋糕 好吃
2747,0,菜品 味道 不错 满意 很多 包房 环境 很好
2748,0,味道 不错 这次 放开 无限 自助 加多宝 实惠 性价比 下次 这家
2749,0,一如既往 好吃 新年 涨价 实惠 推荐 蔬菜
2750,0,环境 菜品 味道 非常 廉价
2751,0,每次 东西 不想 下次 不买
2752,0,味道 棒棒 太贵
2753,0,辣椒 没说 辣椒 最近 两次 三分之二 辣椒 辣椒
2754,0,酱汁 差点 服务 味道 不错 下次
2755,0,东西 同学 一起 老板 很好
2756,0,好吃 团购 划算 买点
2757,0,第一次 味道 不错 应该 要点 一点 小朋友 喜欢 喝哟 喝多 不好 一般 买来 附近 朋友 味道 不错 以后 肯定 这家 态度 很好 值得 强烈推荐 黑糖 乌龙 奶盖
2758,0,老板 特别 烤鱼 好吃 每个 礼拜 够味儿
2759,1,一个 虫
2760,0,味道 特别 老板 很好 热情 值得 已经 多次 赶快 行动
2761,0,品牌 值得 信赖 希望 继续 保持
2762,0,位置 好找 大洋 百货 里面 经常 速度 挺快
2763,0,味道 不错 薯条 分量 很足
2764,0,态度 不会
2765,0,味道 上菜 肉质 鲜嫩 可口 服务态度
2766,1,全是 鸡精 芋头 食材 一点 不新鲜 难吃
2767,0,顾客
2768,0,阳光 世纪 购物中心 L5 好找 阳光 世纪 很大 舒适 吃喝玩乐 几次 环境 装修 高大 温馨 生意 不错 这次 团购 真的 超级 划算 东西 便宜 赞赞赞
2769,0,一点 味道 特别
2770,0,味道 棒棒 一次 解放碑 至少 一次 特别 特别 喜欢
2771,0,还可以 几次 团购 主要 小孩 喜欢
2772,0,不错 饮品 回购 希望 继续 保证 酸奶 质量
2773,0,分量 太足 四个 完全 吃不完 打包 回去 一顿饭 下次 带个 打包 十分满意
2774,0,肉嫩 多汁 好吃 不会 难怪 平时 多人 排队
2775,0,好吃 多次 忠实 粉丝
2776,0,简直 不想 这家 东西 难吃 半小时 送到 超时 卖家 一个 电话 没有 虾线 虾头 花甲 咬起 全是 鲜椒 鲫鱼 老子 一颗 花椒 看到 从来 没吃过 难吃 小龙虾 几百块 一桶 方便面 好吃 要不是 最低 只能 一颗 真的 一个 不想 湖北 小龙虾 ## 湖北 油焖 小龙虾 ## 鲜椒 鲫鱼 ## 花甲
2777,0,滑肉套 好吃 凉粉 很好 喜欢 滑肉
2778,0,味道 不错 好吃 分量 很足
2779,0,味道 不错 第二次 价钱 合适
2780,0,已经 知道 评价 多次 味道 很好
2781,0,真的 难吃 不会 下次
2782,0,一如既往 分量 有点 偏少 希望 下次 时候 分量 增加 一点 完美
2783,0,服务 东西 不错 多次
2784,0,猪蹄 红烧肉
2785,0,味道 很好 老板 态度 起来 感觉
2786,0,香草 奶绿 阵阵 茉莉花茶 香气 牛奶 融合 很好 忘记 说少 有点 太甜
2787,0,多次 味道 一如既往 位置 好找
2788,1,今天 汤里 居然 苍蝇
2789,0,蛋糕 味道 很好 店里 服务 很好 值得 购买
2790,0,口味 不错 菜品 好评
2791,0,菜凉 难吃 原来 味道
2792,0,味道 菜品 分量 足下 一定 赞赞
2793,0,喝过 好喝 酸奶 没有 之一
2794,0,老板娘 服务 真心 非常 味道 很好 特别 牛肉
2795,0,不怎么 好吃
2796,1,辣翅 臭了 知道 多久
2797,0,味道 还行 已经 知道 几次 菜品 比较
2798,0,味道 不错 分量 机会
2799,1,昨天 张妈 肚子痛 一天 一个 晚上 一直 拉肚子 吃饭 吃不下 现在 没有 生气 现在 必须 评论 一下
2800,0,好吃 味道 很好 老板 服务态度 很好 中午 很多
2801,0,菜品 丰盛 味道 不错
2802,0,每年 暑假 回来 朋友 会儿 聊天
2803,0,已经 第三次 感觉 不错 家人 喜欢
2804,0,菜品 丰富 干净 卫生 位置 方便 值得 推荐
2805,0,味道 不错 好吃 加上 团购 便宜 喜欢 以后 还会 继续 不错 上菜 速度 有点
2806,0,哎哟 喜欢 味道 口福 辣辣辣
2807,1,里面 有虫 看到 没有 食欲
2808,0,两次 晓得 东西 难吃 不得
2809,1,顾客 最起码 几天 饭菜 今天 真的 失望 中午 点餐 一直 三点 多才 吃饭 两点 左右 送到 上次 下单 一个 鸡蛋 没有 打电话 协商 下次 下单 两个 今天 下单 备注 两个 鸡蛋 不假 一个 鸡蛋 明显 臭了 异味 两个 鸡蛋 店里 一个 不会 计较 一个 鸡蛋 真的 生气 炒饭 味道 以后 绝对 不会 你家 包括 身边 外卖 本来 晚上 跟着 一起 炒饭 打开 饭盒 闻到
2810,0,石桥铺 不错 感觉 地方 干净
2811,1,蟑螂 吃个 玩意
2812,0,味道 很好 感觉 大份 没有 观音桥 店多
2813,0,非常 超值 味道 不错
2814,1,味道 东西 没有 入味 很少
2815,1,多次 这次 居然 拉肚子 两份 第一天 拉肚子 以外 受凉 结果 今天 第二份 拉肚子 知道 经历
2816,0,顺水 鱼馆 加州 地理位置 非常 好找 加州 城市 花园 大门 店面 干净 整洁 服务态度 不错 菜品 新鲜 味道 正宗 麻鱼 特色菜 充分体现 重庆 地方 特色 很足 配菜 很多 宴请 宾客 最佳 去处 麻鱼 顺水 鱼密制 豆腐 手工 面块 泡菜 油炸 豌豆
2817,1,鸭肠 香菜 丸子 臭的 不会 第二次 第一次 不满意
2818,0,很少 点评 真心 环境 超赞 服务 没有 团购 怠慢 老板娘 贴心 问要 不要 围裙 女孩子 吃面 衣服 不好
2819,0,几次 不错 下次 还会
2820,1,平时 点评 昨天 晚上 肚子疼 晚上 安稳 希望 老板 注意 卫生
2821,0,非常 不错 各个 口味 好吃 下次 试一试 生日蛋糕
2822,0,味道 还可以 菜品 新鲜 两个 刚刚
2823,0,好吃 划算 一家人 非常 满意
2824,0,菜品 很好 分量足 服务态度 不错 八人餐 小菜 几乎 没有 太多菜 饮料 好喝
2825,0,石锅 好吃 饮料 好喝
2826,0,味道 环境 品种 份量 有点
2827,0,阔以 味道 不错 分量足
2828,1,味道不好 脖有 异味
